{
  "schema_id": "knowledge.collection-spec",
  "schema_version": 1,
  "collection_id": "paper-kb-proof-catalog",
  "title": "Paper KB catalog proof",
  "description": "Executable cross-repository proof collection generated from pinned Paper KB producer code and sanitized source artifacts.",
  "source": {
    "adapter": "paper-catalog-jsonl",
    "path": "generated.catalog.jsonl",
    "authority": "repo.paper-kb",
    "release_id": "ecf09f19c3211de85eea6e4f81a0c2a48f378fc0"
  },
  "selection": {"mode": "all"}
}
