{
  "schema_id": "knowledge.collection-spec",
  "schema_version": 1,
  "collection_id": "working-memory-journal",
  "title": "Working-memory journal — explicit-publication collection",
  "description": "Conservative metadata-only subset of exact versioned journal notes carrying explicit publish:true; Quartz remains publication authority.",
  "source": {
    "adapter": "jsonl",
    "path": "source/items.jsonl",
    "authority": "repo.journal",
    "release_id": "git:11fc6ea42e13866cd952e4957c26dd2e55ef78d7"
  },
  "selection": {
    "mode": "all"
  }
}
