{
  "schema_id": "knowledge.collection-spec",
  "schema_version": 1,
  "collection_id": "fcv-literature-corpus",
  "title": "FCV literature seed corpus — Eric Mvukiyehe",
  "description": "Seven-paper governed seed corpus drawn from the real eric-mv Paper KB fixture. This is an intentionally bounded first FCV literature slice, not a claim of complete FCV coverage.",
  "source": {
    "adapter": "paper-catalog-jsonl",
    "path": "source/paper.catalog-record.v1.jsonl",
    "authority": "repo.paper-kb",
    "release_id": "paper-kb:e82e82deb646f30707306cd13ff8ba279c8bad50:eric-mv:catalog:sha256:273a484b873d5ae6f9041b24e3c8b4906d23d0683b26941c95713665353f1b41"
  },
  "selection": {
    "mode": "all"
  }
}
